{
  "event_id": "4e959251e72c7f9c2bcf43acbcdf51ac69baf4542c49ff55e363316299b1da5e",
  "datetime": "2026-03-14T08:55:03Z",
  "timestamp_raw": "2026-03-14 04:55:03.000 -04:00",
  "source_timezone": "UTC-04:00",
  "timestamp_desc": "logged",
  "message": "Network Logon with Stolen Service Account Credentials",
  "host": "WIN-FILE-02",
  "principal": "CORP\\svc-backup",
  "action": "logon",
  "object": "10.4.12.66",
  "source_tool": "hayabusa",
  "source_artifact": "Security.evtx",
  "details": {
    "win_event_id": 4624,
    "channel": "Security",
    "fields": {
      "LogonType": "3",
      "TargetUserName": "svc-backup",
      "WorkstationName": "WIN-ACCT-07",
      "IpAddress": "10.4.12.66",
      "TargetLogonId": "0xaee7b1",
      "AuthenticationPackageName": "NTLM",
      "ProcessName": "-",
      "SubjectDomainName": "CORP",
      "SubjectLogonId": "0x3e7",
      "SubjectUserName": "WIN-FILE-02$",
      "SubjectUserSid": "S-1-5-18",
      "TargetDomainName": "CORP",
      "TargetUserSid": "S-1-5-21-1111111111-2222222222-3333333333-1188"
    },
    "level": "high",
    "rule_title": "Network Logon with Stolen Service Account Credentials",
    "rule_file": "Sec_4624_High_NetworkLogonWithStolenServiceAccountCredentials.yml",
    "rule_id": "2e273d3d-974b-561b-8bff-039832f22521",
    "mitre_tactics": [
      "InitAccess",
      "Persis",
      "PrivEsc",
      "Stealth"
    ],
    "rule_mitre_tags": [
      "T1078.002"
    ]
  },
  "attack_techniques": [
    {
      "technique_id": "T1078.002",
      "mapping_source": "rule_tag"
    }
  ],
  "ioc_refs": [
    "ioc-a6459058911d"
  ],
  "confidence": 1.0,
  "raw_ref": {
    "source_file": "synthetic_hayabusa.csv",
    "record": "81463"
  },
  "tags": [
    "episode:EP-95595e4bef78"
  ]
}
